src/main/resources/data/cygnus/cygnus/planets/earth.json

{
	"dimension": "minecraft:overworld",
	"gravity": 9.807,
	"has_oxygen": true,
	"day_length": 12000,
	"night_length": 12000,
	"year_length": 365.2422,
	"ambient_temperature_curve": [
		{ "x": 0.00, "y": 15.0 }, // dawn
		{ "x": 0.25, "y": 15.4 }, // midday
		{ "x": 0.50, "y": 14.6 }, // midnight
		{ "x": 1.00, "y": 15.0 } // dawn
	],
	"ambient_radiation": 0,
	"moons": [
		"cygnus:luna"
	],
	"atmospheric_pressure": 1,
	"danger_index": "habitable"
}

doc/addon-development/data/planets.md

# Planet Files

"year_length": 365.2422, // The orbital period in earth days. For moons, this would be the month length.
	"ambient_temperature_curve": [ // The temperature curve in celsius.
		{ "x": 0.00, "y": 15.0 }, // dawn
		{ "x": 0.25, "y": 15.4 }, // midday
		{ "x": 0.50, "y": 14.6 }, // midnight
		{ "x": 1.00, "y": 15.0 } // dawn
	],
	"ambient_radiation": 0, // TBD
	"moons": [ // The moons of the body. You can have as many moons as you please. You can also have moons of moons.
		"cygnus:the_moon",
    "cygnus:deimos",
    "cygnus:phobos",
	],
	"atmospheric_pressure": 1, // The atmosphere's pressure at the surface in Earth atmospheres. A value of 2 would mean it is 2x the pressure of Earth's.
	"danger_index": "habitable" // The danger index, which tells the player what to expect. The danger index values and meanings are listed in the documentation.
}